Url,Company,Keyword,K repeated,Context,Evidence,Aim,Typology,Animal,Food,Resources,Distribution,Waste,Management,Actions
https://www.wendys.com/blog/five-ways-wendys-is-celebrating-earth-day-every-day,wendy's,emissions,1,"We’re also proud that our Restaurant Support Center has cut their energy usage by 28 percent, in effect helping lower greenhouse gas emissions by more than 27 percent compared to the 2013 base.",TRUE,take action,paragraph,FALSE,FALSE,TRUE,FALSE,TRUE,FALSE,TRUE
https://www.wendys.com/csr-what-we-value/food/responsible-sourcing/animal-welfare/animal-care-standards-program,wendy's,emissions,2,"For example, we identified efforts by the Beef Marketing Group, a cooperative of beef producers and one of Wendy’s beef supply chain partners, to pilot and validate a system that quantifies greenhouse gas emissions to understand its own emissions baseline. The pilot, which began in 2021, enables the cooperative to track and analyze data related to feed rations, energy, fuel and water use, and more to get a real-time view of the footprint of its feedyards.",FALSE,dissemination,paragraph,TRUE,FALSE,FALSE,FALSE,TRUE,TRUE,FALSE
https://www.wendys.com/blog/energy-savings-come-alive,wendy's,emissions,1,"The Dublin Restaurant Support Center—Wendy’s headquarters—has reduced energy usage by an impressive 34 percent, thereby lowering greenhouse gas emissions by 24 percent over the 2013 baseline year.",TRUE,take action,paragraph,FALSE,FALSE,TRUE,FALSE,TRUE,FALSE,TRUE
https://www.wendys.com/csr-what-we-value/food/responsible-sourcing/fresh-produce,wendy's,emissions,1,"In 2020, Wendy’s transitioned the lettuce served in Wendy’s restaurants in Canada to greenhouse-grown lettuce. Our suppliers’ greenhouses capture waste heat and carbon dioxide, reducing emissions and creating a self-sufficient source of electricity and heating, while saving water (up to 90% savings from traditional growing methods). This lettuce is also grown without the use of pesticides.",TRUE,take action,paragraph,FALSE,TRUE,FALSE,FALSE,TRUE,FALSE,TRUE
https://www.wendys.com/blog/announcing-2020-corporate-responsibility-achievements-and-goals,wendy's,emissions,1,"As for our priorities within Footprint, we are committed to setting a science-based target for GHG reduction, which will help us align with the recommendations set forth by the Paris Climate Agreement. We put this in motion by taking inventory of GHG emissions specific to our operations. We are also announcing a near-term goal to sustainably source 100% of our customer-facing packaging by 2026.",FALSE,take action,paragraph,FALSE,FALSE,TRUE,FALSE,TRUE,TRUE,FALSE
https://www.wendys.com/blog/2021-corporate-responsibility-progress,wendy's,emissions,1,"This year, Wendy’s conducted our first greenhouse gas (GHG) inventory, an important step that informed our climate roadmap. As part of this roadmap, we shared our commitment to benchmark, track and reduce our Scope 1, Scope 2 and Scope 3 GHG emissions and set a science-based target by the end of 2023",FALSE,dissemination,paragraph,FALSE,FALSE,FALSE,FALSE,TRUE,TRUE,TRUE
https://www.wendys.com/csr-what-we-value/footprint/climate-energy,wendy's,natural,2,"In 2020, Wendy’s completed our first GHG inventory, which measured our Scope 1 and 2 emissions of natural gas, propane, gasoline and electric power at all Company-operated restaurants as well as in fleet vehicles and in corporate offices in calendar year 2019. Looking forward, Wendy’s will benchmark, track and reduce our Scope 1, Scope 2 and Scope 3 GHG emissions and set a science-based target by the end of 20231.",TRUE,take action,paragraph,FALSE,FALSE,TRUE,FALSE,FALSE,TRUE,TRUE
https://www.wendys.com/blog/palm-oil-2016,wendy's,natural,2,"High demand for palm oil supports millions of farmers and their families in palm oil producing countries. But palm oil production has significant challenges too, and some production methods are linked to natural resource and wildlife damage, as well as negative social impacts. ",FALSE,dissemination,paragraph,FALSE,TRUE,FALSE,FALSE,FALSE,TRUE,FALSE
https://www.wendys.com/csr-what-we-value/food/responsible-sourcing/fresh-produce,wendy's,natural,1,"Greenhouse-grown tomatoes also make the most efficient use of water and fertilizer, eliminate runoff and use natural Integrated Pest Management methods such as beneficial insects like ladybugs to make pesticides a last resort.",FALSE,take action,paragraph,FALSE,TRUE,FALSE,FALSE,FALSE,FALSE,FALSE
https://www.wendys.com/blog/2021-corporate-responsibility-progress,wendy's,natural,2,"In 2012, Wendy’s announced a 10-year goal to transition our supply chain for pork (bacon and sausage used by Wendy’s restaurants in North America) away from individual sow gestation stalls in favor of open pen/group housing for pregnant sows, which allows them to socialize and exhibit natural behaviors.",FALSE,take action,paragraph,TRUE,TRUE,FALSE,FALSE,FALSE,TRUE,FALSE
https://www.wendys.com/csr-what-we-value/food/responsible-sourcing/fresh-produce/hydroponic-farming,wendy's,natural,1,"Hydroponic greenhouses have control over light, temperature, humidity and airflow. The control over these elements creates an environment that produces consistent quality in tomatoes all year long. Greenhouse farming also uses less water, land and fertilizer than field farming, eliminates runoff and uses natural Integrated Pest Management (IPM) methods to make pesticides a last resort. Greenhouses also provide, by design, an indoor, temperature-controlled work environment.",FALSE,dissemination,paragraph,FALSE,TRUE,TRUE,FALSE,FALSE,TRUE,FALSE
https://www.wendys.com/csr-what-we-value/food/responsible-sourcing/beef,wendy's,natural,1,Environmental sustainability: Responsibly utilizing natural resources while investing in the people who care for the cattle and the local communities through staff training and certification,FALSE,take action,statement,TRUE,TRUE,FALSE,FALSE,FALSE,TRUE,FALSE
https://www.wendys.com/blog/investing-in-quality-and-making-progress-on-animal-antibiotics,wendy's,natural,1,CHICKENS AT WENDY’S SUPPLIER PERDUE BENEFIT FROM A BARN WITH PLENTY OF NATURAL LIGHT.,FALSE,dissemination,subtitle,TRUE,TRUE,FALSE,FALSE,FALSE,FALSE,FALSE
https://www.wendys.com/csr-what-we-value/footprint/climate-energy,wendy's,greenhouse gas,1,Our journey to greenhouse gas (GHG) reduction targets,TRUE,take action,title,FALSE,FALSE,FALSE,FALSE,TRUE,TRUE,TRUE
https://www.wendys.com/csr-what-we-value/footprint,wendy's,greenhouse gas,1,"In 2020, Wendy’s conducted our first greenhouse gas (GHG) inventory and created a roadmap to reduce GHG emissions and set a science-based target by the end of 2023. ",TRUE,take action,paragraph,FALSE,FALSE,TRUE,FALSE,FALSE,TRUE,TRUE
https://www.wendys.com/blog/five-ways-wendys-is-celebrating-earth-day-every-day,wendy's,greenhouse gas,1,"We’re also proud that our Restaurant Support Center has cut their energy usage by 28 percent, in effect helping lower greenhouse gas emissions by more than 27 percent compared to the 2013 base.",TRUE,take action,paragraph,FALSE,FALSE,TRUE,FALSE,TRUE,FALSE,TRUE
https://www.wendys.com/blog/energy-savings-come-alive,wendy's,greenhouse gas,1,"The Dublin Restaurant Support Center—Wendy’s headquarters—has reduced energy usage by an impressive 34 percent, thereby lowering greenhouse gas emissions by 24 percent over the 2013 baseline year.",TRUE,take action,paragraph,FALSE,FALSE,TRUE,FALSE,TRUE,FALSE,TRUE
https://www.wendys.com/blog/wendys-awards-innovative-supply-chain-leaders,wendy's,greenhouse gas,1,"Cargill also recently announced a new initiative to further accelerate sustainability progress across the North American beef supply chain, working with farmers, ranchers and innovators to achieve a 30% greenhouse gas (GHG) intensity reduction by 2030, equivalent to removing 2 million cars off U.S. highways for a year).",TRUE,take action,paragraph,FALSE,FALSE,TRUE,FALSE,FALSE,FALSE,FALSE
https://www.wendys.com/blog/announcing-2020-corporate-responsibility-achievements-and-goals,wendy's,greenhouse gas,1,"Despite the myriad challenges we all faced in 2020, we accomplished a great deal. Highlights include implementing our new Animal Care Standards Program, conducting an inventory of our greenhouse gas (GHG) footprint, and completing our first materiality assessment to help us better understand our priority topics.",FALSE,take action,paragraph,TRUE,FALSE,FALSE,FALSE,TRUE,TRUE,FALSE
https://www.wendys.com/csr-what-we-value/footprint/food-waste,wendy's,greenhouse gas,1,"Our Company-operated and franchised restaurants in the U.S. and Canada work with Darling Ingredients’ service brand DAR PRO Solutions to convert used cooking oil from our fryers into renewable diesel fuel, an energy source that emits up to 85% less greenhouse gas compared to petroleum diesel.",TRUE,dissemination,paragraph,FALSE,TRUE,FALSE,FALSE,TRUE,FALSE,TRUE
https://www.wendys.com/csr-what-we-value/food/responsible-sourcing/animal-welfare/animal-care-standards-program,wendy's,greenhouse gas,1,"For example, we identified efforts by the Beef Marketing Group, a cooperative of beef producers and one of Wendy’s beef supply chain partners, to pilot and validate a system that quantifies greenhouse gas emissions to understand its own emissions baseline. ",FALSE,dissemination,paragraph,TRUE,FALSE,FALSE,FALSE,TRUE,TRUE,FALSE
https://www.wendys.com/blog/2021-corporate-responsibility-progress,wendy's,greenhouse gas,1,"This year, Wendy’s conducted our first greenhouse gas (GHG) inventory, an important step that informed our climate roadmap. As part of this roadmap, we shared our commitment to benchmark, track and reduce our Scope 1, Scope 2 and Scope 3 GHG emissions and set a science-based target by the end of 2023.",TRUE,take action,paragraph,FALSE,FALSE,TRUE,FALSE,FALSE,TRUE,TRUE
https://www.wendys.com/csr-what-we-value/footprint/sustainable-packaging,wendy's,deforestation,1,"To accomplish this, over the next five years, Wendy’s will optimize our customer-facing packaging and transition to sustainable options, including items that:   
- Have higher recycled content
- Use fewer raw materials    
- Adhere to an established restricted substance list  
- Are recyclable, compostable or reusable 
- Are sourced from areas that do not contribute to deforestation",FALSE,take action,paragraph,FALSE,FALSE,FALSE,TRUE,TRUE,FALSE,TRUE
https://www.wendys.com/csr-what-we-value/footprint/corporate-office-initiatives,wendy's,green,1,Piloting Green Programs,FALSE,take action,title,FALSE,FALSE,FALSE,FALSE,TRUE,TRUE,TRUE
https://www.wendys.com/blog/wendys-and-energy-management,wendy's,green,1,"Wendy’s is a committed advocate of energy conservation and sustainability. As a long-time member, we support the commitment the U.S. Green Building Council (USGBC) has made to develop a prosperous and sustainable future for our nation through cost-efficient and energy-saving sustainable buildings.",FALSE,take action,paragraph,FALSE,FALSE,TRUE,FALSE,TRUE,TRUE,FALSE
https://www.wendys.com/blog/2021-good-done-right-award,wendy's,green,2,"Antunes is a toaster supplier to Wendy’s, and at one facility, the company generates 12% of its total energy usage through solar power. The company also purchases 50% of its electricity from green sources.",TRUE,take action,paragraph,FALSE,TRUE,TRUE,FALSE,FALSE,FALSE,TRUE
https://www.wendys.com/csr-what-we-value/footprint/climate-energy,wendy's,climate change,1,"We also reported 2020 data to CDP Climate Change Disclosure, a leading disclosure practice for environmental reporting, for the first time in 2021. We are encouraged and proud to have received a B score on our first submission, and we plan to continue submitting in coming years.",TRUE,dissemination,paragraph,FALSE,FALSE,FALSE,FALSE,TRUE,TRUE,FALSE
https://www.wendys.com/csr-what-we-value/footprint/climate-energy/energy-conservation-initiatives,wendy's,renewable energy,1,"In 2021, Wendy’s achieved a 17% reduction in energy per square foot for our Company operations against our 2012 baseline. We also grew our relationship with the U.S. Department of Energy by signing onto its Better Buildings® Low Carbon Pilot initiative, which aims to demonstrate how companies are achieving carbon dioxide emission reductions through energy efficiency and renewable energy development or procurement.",TRUE,take action,paragraph,FALSE,FALSE,TRUE,FALSE,TRUE,FALSE,TRUE
https://www.wendys.com/csr-what-we-value/footprint/climate-energy,wendy's,renewable energy,2,"Sourcing renewable energy for our Company operated restaurant sites is an important component of reducing emissions, which we expect to be an important piece of our science-based target strategy.",FALSE,take action,paragraph,FALSE,FALSE,TRUE,FALSE,TRUE,TRUE,FALSE
https://www.wendys.com/csr-what-we-value/footprint/sustainable-packaging,wendy's,single-use,1,"In 2019, Wendy’s became a supporting partner of the NextGen Consortium, a collaboration managed by Closed Loop Partners that is devoted to finding global solutions to reduce single-use food packaging waste. We continue to work closely with NextGen as it expands its work beyond its initial focus on fiber to-go cups. NextGen Consortium is now working to identify even more opportunities to advance the design, commercialization and recovery of packaging alternatives — from new materials and recovery strategies to reusable packaging systems that keep materials in use for as long as possible. ",FALSE,take action,paragraph,FALSE,FALSE,FALSE,TRUE,TRUE,TRUE,FALSE
https://www.wendys.com/blog/environmental-sustainability-wendys-way-squarely-sustainable,wendy's,single-use,2,"The issue of single-use plastics and paper is not an easy one to solve, but that’s not a reason to give up. There simply are not widely available, commercially feasible packaging options to replace plastic, particularly when it comes to items like straws and lids that are recyclable, compostable or biodegradable.",FALSE,dissemination,paragraph,FALSE,FALSE,FALSE,TRUE,TRUE,TRUE,FALSE
https://www.wendys.com/blog/sustainability-wendys-way-celebrating-earth-day,wendy's,single-use,2,"By now, most of us are aware that we need to reduce single-use plastic across the globe. At Wendy’s, we’re committed to decreasing the amount of plastic used in straws by 19 percent by the end of this year. ",FALSE,take action,paragraph,FALSE,FALSE,FALSE,TRUE,TRUE,TRUE,FALSE
https://www.wendys.com/csr-what-we-value/footprint/corporate-office-initiatives/gardens,wendy's,organic,4,"In June 2022, the Squarely Sustainable Council hosted its first-ever Lunch & “Turn”! Employees from across multiple functions came together to till, turn soil and plant our campus organic garden.

We plan to use the garden, which boasts produce and a variety of herbs, for educational events and culinary experiences.",TRUE,take action,paragraph,FALSE,FALSE,FALSE,FALSE,FALSE,TRUE,TRUE
https://www.wendys.com/blog/environmental-sustainability-wendys-way-squarely-sustainable,wendy's,eco-friendly,1,"At Wendy’s, we know our customers are increasingly aware of packaging waste and its impact on our environment, and they’re also looking for more eco-friendly packaging options. ",FALSE,take action,paragraph,FALSE,FALSE,FALSE,TRUE,TRUE,TRUE,FALSE
https://www.wendys.com/blog/environmental-sustainability-wendys-way-squarely-sustainable,wendy's,biodegradable,1,"The issue of single-use plastics and paper is not an easy one to solve, but that’s not a reason to give up. There simply are not widely available, commercially feasible packaging options to replace plastic, particularly when it comes to items like straws and lids that are recyclable, compostable or biodegradable.",FALSE,dissemination,paragraph,FALSE,FALSE,FALSE,TRUE,TRUE,TRUE,FALSE
https://www.wendys.com/csr-what-we-value/footprint,wendy's,planet,1,"“Reducing our footprint isn’t just good for the planet, it’s good for business. Together with our franchisees, we’ve made great strides to benchmark, understand, and reduce our energy and water use in our restaurants through the Better Buildings Challenge.”",FALSE,take action,statement,FALSE,FALSE,TRUE,FALSE,TRUE,TRUE,FALSE
https://www.wendys.com/blog/beyond-the-food-wendys-recognized-as-outstanding-workplace,wendy's,planet,3,"We believe our business operations and the natural world are closely linked, and we continually work to make the world a better place by reducing our impact on the environment.",FALSE,take action,paragraph,FALSE,FALSE,FALSE,FALSE,TRUE,TRUE,FALSE
https://www.wendys.com/blog/good-done-right-new-corporate-social-responsibility-platform,wendy's,planet,1,"As we embark on the next 50 years, we remain committed to the values that Dave Thomas taught us, and we believe that doing the right thing – for our people, our customers and our planet – is the only responsible way to do business.",FALSE,take action,paragraph,FALSE,FALSE,FALSE,FALSE,FALSE,TRUE,FALSE
https://www.wendys.com/blog/food-safety-is-first-ingredient,wendy's,planet,2,"This year, the WHO’s World Food Safety Day theme is “Safe food today for a healthy tomorrow.” I invite you to read more from Wendy’s Quality Assurance (QA) team below about how this theme underscores the fact that production and consumption of safe food has immediate and long-term benefits for people, the planet and the economy.",FALSE,dissemination,paragraph,FALSE,TRUE,FALSE,FALSE,FALSE,TRUE,FALSE
https://www.wendys.com/en-uk/what-we-value,wendy's,planet,1,"More than 50 years later, we remain committed to the values Dave taught us, and we believe that doing the right thing – for our people, our customers and our planet – is the only responsible way to do business.",FALSE,take action,paragraph,FALSE,FALSE,FALSE,FALSE,FALSE,TRUE,FALSE
https://www.wendys.com/blog/how-do-we-feel-about-antibiotics-for-people-and-animals-its-complicated,wendy's,planet,2,"We believe that our food supply is the safest in the world, and we are proud to be a part of a community that is truly feeding the planet. We are grateful to farmers and ranchers for all that they do every day.",FALSE,dissemination,paragraph,TRUE,TRUE,FALSE,FALSE,FALSE,TRUE,FALSE
https://www.wendys.com/blog/profiles-in-quality-hord-family-farms,wendy's,planet,1,"Care – we care about people, animals and the planet",FALSE,take action,statement,TRUE,FALSE,FALSE,FALSE,TRUE,TRUE,FALSE
https://biz.dominos.com/stewardship/responsible-sourcing/,Domino's,impact,2,"Having completed our first assessment for not only emissions, but also land use change impacts, we are pleased that the vast majority of our sourcing choices to-date have resulted in few ingredients with deforestation impacts.",FALSE,take action,paragraph,FALSE,TRUE,FALSE,FALSE,FALSE,FALSE,TRUE
https://biz.dominos.com/stewardship/responsible-sourcing/,Domino's,impact,1,"While palm oil represents one of Domino’s ingredients that has the highest potential impact on deforestation, our supply chain team has taken extra steps to reduce the risk.",FALSE,take action,paragraph,FALSE,TRUE,FALSE,FALSE,FALSE,TRUE,FALSE
https://biz.dominos.com/assets/js/pizza-footprint/index.html,Domino's,impact,1,"THE ENVIRONMENTAL IMPACT
OF A DOMINO'S PIZZA",FALSE,,title,FALSE,FALSE,FALSE,FALSE,FALSE,FALSE,FALSE
https://biz.dominos.com/assets/js/pizza-footprint/index.html,Domino's,impact,1,Play along and you can create your own Domino’s pizza and learn how the different ingredients impact its carbon footprint.,FALSE,dissemination,subtitle,FALSE,FALSE,FALSE,FALSE,TRUE,FALSE,FALSE
https://biz.dominos.com/assets/js/pizza-footprint/index.html,Domino's,impact,2,"To create this simulation, Domino’s worked with a third party, Quantis Inc., to calculate the environmental impact of a large size pizza, including pizza box. This data is derived from a corporate footprint performed in 2021 of Domino's business in the United States, using FY 2019 data. Carbon emissions data from two leading life cycle assessment (LCA) databases, WFLDB and ecoinvent, in combination with supply chain specific data and assumptions from Domino’s and its suppliers, was used to estimate environmental impacts. As new information becomes available, methodologies and carbon emissions estimates may be updated.",TRUE,dissemination,paragraph,FALSE,TRUE,FALSE,FALSE,TRUE,FALSE,FALSE
https://biz.dominos.com/stewardship/environmental-footprint/,Domino's,impact,1,"More than 95% of our total carbon emissions fall within scope 3 – these are emissions that are a result of activities from assets not owned or controlled by Domino’s. This includes the emissions impacts from ingredients we purchase from suppliers, utilities and transportation, including delivery to our customers.",TRUE,take action,paragraph,FALSE,FALSE,FALSE,FALSE,TRUE,FALSE,TRUE
https://biz.dominos.com/stewardship/environmental-footprint/,Domino's,impact,3,"Water is a key resource that is facing increased variability and availability due to climate change impacts. Domino’s initial environmental footprint included water usage so that we could gain a better understanding of its impact and opportunities. Going forward we will look to implement systems and programs to track water usage more closely, as well as understand watershed implications from key suppliers with the greatest water impact.",FALSE,dissemination,paragraph,FALSE,FALSE,TRUE,FALSE,FALSE,TRUE,FALSE
https://biz.dominos.com/stewardship/environmental-footprint/,Domino's,impact,1,Our box suppliers do not purchase from operations that would have an adverse impact to regions of high conservation value.,FALSE,take action,paragraph,FALSE,FALSE,FALSE,TRUE,FALSE,FALSE,TRUE
https://biz.dominos.com/stewardship/environmental-footprint/,Domino's,impact,1,"According to the American Forest & Paper Association (AF&PA), corrugated cardboard can be recycled at least seven times, and grease and cheese do not impact recyclability. However, this information isn’t widely known and customers are often confused about what to do with leftover pizza boxes.",TRUE,dissemination,paragraph,FALSE,FALSE,FALSE,FALSE,TRUE,FALSE,FALSE
https://biz.dominos.com/stewardship/,Domino's,impact,1,"Focus on science-based climate actions to cut greenhouse gas emmissions, reduce water impact and minimize waste.",FALSE,take action,subtitle,FALSE,FALSE,FALSE,FALSE,TRUE,TRUE,FALSE
https://biz.dominos.com/stewardship/,Domino's,impact,3,community impact,FALSE,,title,FALSE,FALSE,FALSE,FALSE,FALSE,FALSE,FALSE
https://biz.dominos.com/stewardship/community-impact/,Domino's,sustainability,1,Environment & Sustainability,FALSE,,title,FALSE,FALSE,FALSE,FALSE,FALSE,FALSE,FALSE
https://biz.dominos.com/,Domino's,environmental,1,Environmental footprint,FALSE,,title,FALSE,FALSE,FALSE,FALSE,FALSE,FALSE,FALSE
https://biz.dominos.com/stewardship/employee-resource-groups/,Domino's,environmental,1,Environmental footprint,FALSE,,title,FALSE,FALSE,FALSE,FALSE,FALSE,FALSE,FALSE
https://biz.dominos.com/stewardship/community-impact/,Domino's,environmental,1,"Domino’s began its relationship with FFA in 2017 with a five-year, $1 million commitment that supported the organization’s agriculture literacy and advocacy programs, and its Living to Serve platform, which promotes hunger and environmental initiatives in local communities.",TRUE,take action,paragraph,FALSE,FALSE,FALSE,FALSE,FALSE,FALSE,TRUE
https://biz.dominos.com/stewardship/community-impact/,Domino's,environmental,1,"In 2020, Domino’s began focusing on different environmental issues, including reforestation, recycling and the water crisis, by partnering with nonprofit organizations.",FALSE,take action,paragraph,FALSE,FALSE,FALSE,FALSE,TRUE,FALSE,TRUE
https://biz.dominos.com/stewardship/employee-resource-groups/,Domino's,environmental,1,Environmental footprint,FALSE,,title,FALSE,FALSE,FALSE,FALSE,FALSE,FALSE,FALSE
https://web.archive.org/web/20221103011310/https://recycling.dominos.com/,Domino's,recycle,1,We want everyone to know empty corrugated pizza boxes are recyclable. Grease and cheese residue does not prevent boxes from being recycled.,FALSE,dissemination,statement,FALSE,FALSE,FALSE,FALSE,TRUE,TRUE,FALSE
https://biz.dominos.com/stewardship/environmental-footprint/,Domino's,recycle,2,"The vast majority of products that Domino’s sells leave the stores in corrugated boxes. In 2020, Domino’s increased the percent of recycled content in the boxes from 40% to 70% with 100% of our paper-based packaging sourced from fiber from responsibly managed forests and recycled sources.",TRUE,take action,paragraph,FALSE,FALSE,FALSE,FALSE,TRUE,FALSE,TRUE
https://biz.dominos.com/stewardship/environmental-footprint/,Domino's,recycle,1,"According to the American Forest & Paper Association (AF&PA), corrugated cardboard can be recycled at least seven times, and grease and cheese do not impact recyclability.",TRUE,dissemination,paragraph,FALSE,FALSE,FALSE,FALSE,TRUE,FALSE,FALSE
https://biz.dominos.com/stewardship/environmental-footprint/,Domino's,recycle,1,"Domino’s is committed to increasing awareness of the recyclability of pizza boxes and provides tools and information for customers through the website recycling.dominos.com. At this site consumers can learn more about pizza box recycling in their local area, learn facts about how corrugated packaging can be recycled and then encourage their local recycling program to update its recycling guidelines regarding pizza boxes.",TRUE,take action,paragraph,FALSE,FALSE,FALSE,FALSE,TRUE,FALSE,TRUE
https://biz.dominos.com/stewardship/environmental-footprint/,Domino's,recycle,1,"Domino’s hopes to divert pizza boxes from landfills into the recycling stream, to make sure the corrugated fibers reach their full recycled potential.",FALSE,take action,paragraph,FALSE,FALSE,FALSE,FALSE,TRUE,TRUE,FALSE
