Url,Company,Keyword,K repeated,Context,Evidence,Aim,Typology,Animal,Food,Resources,Distribution,Waste,Management,Actions
https://corporate.mcdonalds.com/corpmcd/en-us/our-stories/article/ourstories.environmental_effort.html,McDonalds,environmental,7,"On March 20, the same day McDonald’s announced that it was the first restaurant company in the world to set an approved Science Based Target to reduce greenhouse gas emissions, EDF’s President Fred Krupp nodded to that 1990 alliance and heralded the next stage of environmental progress in a Wall Street Journal op-ed.",FALSE,take action,paragraph,FALSE,FALSE,FALSE,TRUE,TRUE,FALSE,FALSE
https://corporate.mcdonalds.com/corpmcd/en-us/our-stories/article/ourstories.environment_recap_18.html,McDonalds,environmental,6,"To reach these goals, we’re excited to work with leading industry experts, local governments and environmental associations to help us improve our packaging and recycling practices and address infrastructure challenges.",FALSE,dissemination,paragraph,FALSE,FALSE,FALSE,FALSE,TRUE,FALSE,FALSE
https://corporate.mcdonalds.com/corpmcd/our-purpose-and-impact/our-planet/climate-action.html,McDonalds,environmental,14,"In 2017, 2019, 2020 and 2021, McDonald’s U.S. received a SmartWay Excellence Award for outstanding environmental performance and leadership, and was a semifinalist in 2018. The SmartWay Excellence Award is the Environmental Protection Agency’s (EPA) highest recognition for demonstrating leadership in freight supply chain energy and environmental performance.",FALSE,dissemination,paragraph,FALSE,FALSE,TRUE,TRUE,FALSE,TRUE,FALSE
https://corporate.mcdonalds.com/corpmcd/en-us/our-stories/article/ourstories.best_of_green.html,McDonalds,environmental,2,"The ""Best of Green"" selection committee included representatives from McDonald's, Business for Social Responsibility, Ceres, Conservation International, Foresight Design and World Wildlife Fund. Entries were judged based on innovation, environmental and business impacts, scalability and business integration.",FALSE,dissemination,paragraph,FALSE,FALSE,FALSE,FALSE,FALSE,FALSE,TRUE
https://corporate.mcdonalds.com/corpmcd/en-us/our-stories/article/ourstories.making_a_big_impact.html,McDonalds,environmental,2,"For years we’ve been crowdsourcing creative solutions from a number of environmental organizations — including the Environmental Defense Fund (EDF) — to help with some of our most interesting challenges, like single-use cups. In fact, early last year we teamed up with Closed Loop Partners to launch the NextGen Cup Challenge with hopes of creating a recyclable or compostable cup to use in our restaurants — something we know our customers are very excited about.",FALSE,take action,paragraph,FALSE,FALSE,TRUE,FALSE,FALSE,TRUE,FALSE
https://corporate.mcdonalds.com/corpmcd/en-us/our-stories/article/ourstories.edf_leadership.html,McDonalds,environmental,3,"“If McDonald’s history of sustainability leadership tells us anything, it’s that this company can prove what’s possible when you set ambitious goals, collaborate with unexpected partners, and leverage one of the world’s most powerful brands to drive environmental innovation and results,”",FALSE,dissemination,statement,FALSE,FALSE,FALSE,FALSE,FALSE,FALSE,TRUE
https://corporate.mcdonalds.com/corpmcd/our-purpose-and-impact/our-planet/nature-forests-water.html,McDonalds,environmental,5,"Most of McDonald’s environmental impacts occur in our supply chains and so, to protect nature and biodiversity, we continue to engage our suppliers in adopting more sustainable practices. We are investing in innovative solutions and collective action to address climate-related risks and advance processes that are better for the planet.",FALSE,take action,paragraph,FALSE,FALSE,FALSE,TRUE,FALSE,TRUE,FALSE
https://corporate.mcdonalds.com/corpmcd/en-us/our-stories/article/ourstories.carbon_footprint.html,McDonalds,environmental,1,"Climate change is the greatest environmental issue of our time, but what can a burger company do about it? The answer may surprise you.",FALSE,dissemination,paragraph,FALSE,FALSE,FALSE,FALSE,FALSE,FALSE,TRUE
https://corporate.mcdonalds.com/corpmcd/our-purpose-and-impact/food-quality-and-sourcing/responsible-sourcing.html,McDonalds,environmental,10,"One of the primary environmental impacts of raising chickens comes from the use of soy in their feed. In 2021, we continued to meet our previous goal to have 100% of the soy sourced for feed of chicken used in McDonald’s products support deforestation-free supply chains globally.",FALSE,take action,paragraph,TRUE,TRUE,FALSE,FALSE,FALSE,FALSE,FALSE
https://corporate.mcdonalds.com/corpmcd/our-purpose-and-impact/our-planet/packaging-toys-and-waste.html,McDonalds,environmental,2,"We believe that a variety of tools will be needed to advance a circular economy and that markets will need to utilize different tools that deliver the right environmental outcomes for their geography, while meeting our customer and Franchisee needs",FALSE,dissemination,paragraph,FALSE,FALSE,FALSE,FALSE,FALSE,TRUE,FALSE
https://corporate.mcdonalds.com/corpmcd/en-us/our-stories/article/ourstories.packaging_journey.html,McDonalds,environmental,4,"Our sustainable packaging journey dates back to 25 years ago when we established a groundbreaking partnership withEnvironmental Defense Fund(EDF). We not only phased out polystyrene sandwich boxes, but also significantly reduced our environmental impact by cutting solid waste and streamlining material choices. ",FALSE,take action,paragraph,FALSE,FALSE,TRUE,FALSE,TRUE,FALSE,FALSE
https://corporate.mcdonalds.com/corpmcd/our-purpose-and-impact/impact-strategy-and-reporting/governance-and-stakeholder-engagement.html,McDonalds,environmental,5,Collaborated with the Environmental Defense Fund to create our Global Antibiotics Policy.,FALSE,take action,statement,TRUE,FALSE,FALSE,FALSE,FALSE,FALSE,FALSE
https://corporate.mcdonalds.com/corpmcd/en-us/our-stories/article/ourstories.sustainable_cup.html,McDonalds,environmental,3,"As the world’s largest restaurant company, we have the responsibility and opportunity to take action on some of the most pressing social and environmental challenges in the world today. One of these challenges is packaging and waste. Our customers tell us that this is their number one environmental concern. ",FALSE,take action,paragraph,FALSE,FALSE,FALSE,FALSE,TRUE,FALSE,FALSE
https://corporate.mcdonalds.com/corpmcd/en-us/our-stories/article/ourstories.sbti_coalition.html,McDonalds,environmental,3,"Last week, we announced our plans to reduce greenhouse gas emissions related to McDonald’s restaurants and supply chain by 2030, prompting environmental leaders to applaud our Climate Action. ",FALSE,take action,paragraph,FALSE,FALSE,TRUE,FALSE,FALSE,FALSE,FALSE
https://corporate.mcdonalds.com/corpmcd/en-us/our-stories/article/ourstories.fiber_cup_future.html,McDonalds,environmental,2,Our customers tell us that their number one environmental concern is the environmental impact of McDonald’s restaurant packaging and waste.,FALSE,dissemination,paragraph,FALSE,FALSE,FALSE,FALSE,TRUE,FALSE,FALSE
https://corporate.mcdonalds.com/corpmcd/en-us/our-stories/article/ourstories.chow.html,McDonalds,environmental,1,McDonald’s size and reach gives us the responsibility and opportunity to take action on some of today’s most pressing social and environmental challenges,FALSE,dissemination,paragraph,FALSE,FALSE,FALSE,FALSE,FALSE,FALSE,TRUE
https://corporate.mcdonalds.com/corpmcd/en-us/our-stories/article/ourstories.renewable_packaging.html,McDonalds,environmental,3,"Our customers have told us that packaging waste is the top environmental issue they would like us to address. Our ambition is to make changes our customers want and to use less packaging, sourced responsibly and designed to be taken care of after use, working at and beyond our restaurants to increase recycling and help create cleaner communities.",FALSE,take action,paragraph,FALSE,FALSE,TRUE,FALSE,TRUE,FALSE,FALSE
https://corporate.mcdonalds.com/corpmcd/en-us/our-stories/article/ourstories.rainforest_alliance.html,McDonalds,environmental,1,"Frogs are an indicator species of environmental health, according to Rainforest Alliance, which uses the frog as its logo and permits the Rainforest Alliance Certified™ seal on products that meet its rigorous sustainability standards.",FALSE,dissemination,paragraph,FALSE,FALSE,FALSE,FALSE,FALSE,TRUE,TRUE
https://corporate.mcdonalds.com/corpmcd/en-us/our-stories/article/ourstories.climate_change.html,McDonalds,environmental,4,"By maximizing energy efficiency and investing in renewable energy, we’re managing the environmental impacts of our operations, one restaurant at a time. Last year, the restaurants and franchisees in Europe purchased 76% of their electricity from renewable sources across 21 markets.",TRUE,take action,paragraph,FALSE,FALSE,TRUE,FALSE,FALSE,TRUE,FALSE
https://corporate.mcdonalds.com/corpmcd/our-purpose-and-impact/food-quality-and-sourcing/food-safety.html,McDonalds,environmental,1,"In collaboration with our suppliers and other stakeholders, in 2021 we updated our SQMS standards to improve food safety culture assessments and environmental controls, among other enhancements.",FALSE,take action,paragraph,FALSE,TRUE,FALSE,FALSE,FALSE,FALSE,FALSE
https://corporate.mcdonalds.com/corpmcd/our-purpose-and-impact/our-planet/packaging-toys-and-waste.html,McDonalds,recycle,49,"As of 2021, approximately 82.7% of our primary packaging materials, and 96.8%1 of our primary fiber packaging comes from recycled or certified sources, aiming for 100% certified, recycled or renewable materials by the end of 2025.",TRUE,take action,paragraph,FALSE,FALSE,FALSE,FALSE,TRUE,FALSE,FALSE
https://corporate.mcdonalds.com/corpmcd/en-us/our-stories/article/ourstories.renewable_packaging.html,McDonalds,recycle,7,"Currently, 50 percent of McDonald's customer packaging comes from renewable, recycled or certified sources and 64 percent of fiber-based packaging comes from certified or recycled sources. Also, an estimated 10 percent of McDonald's restaurants globally are recycling customer packaging. ",TRUE,take action,paragraph,FALSE,FALSE,FALSE,FALSE,TRUE,TRUE,FALSE
https://corporate.mcdonalds.com/corpmcd/en-us/our-stories/article/ourstories.coffee_recycling.html,McDonalds,recycle,5,"Our restaurants work hard to reuse, reduce and recycle,” she continued.  “We also currently recycle used cooking oil in nearly all of our restaurants. Our napkins are made out of 100% recycled content and we are the first in the industry to have the “How2Recycle” label on many of our recyclable packages, bags and clear cups.",TRUE,take action,statement,FALSE,FALSE,FALSE,FALSE,TRUE,TRUE,FALSE
https://corporate.mcdonalds.com/corpmcd/en-us/our-stories/article/ourstories.packaging-waste.html,McDonalds,recycle,8,"Our goal: To source 100% of our guest packaging from renewable, recycled or certified sources, and recycle guest packaging in 100% of McDonald’s restaurants by 2025. We understand that recycling infrastructure varies from city to city and country to country, but we plan to be part of the solution and help influence powerful change.",FALSE,take action,paragraph,FALSE,FALSE,FALSE,FALSE,TRUE,TRUE,FALSE
https://corporate.mcdonalds.com/corpmcd/our-purpose-and-impact/our-planet.html,McDonalds,recycle,6,"By the end of 2021, in our top 35 markets, on average 35% of restaurants offered guests the opportunity to recycle packaging items.",TRUE,dissemination,paragraph,FALSE,FALSE,FALSE,FALSE,TRUE,FALSE,FALSE
https://corporate.mcdonalds.com/corpmcd/en-us/our-stories/article/ourstories.circular-clear-cup.html,McDonalds,recycle,10,"Luckily for all of us, it’s simple: In Savannah, just rinse and recycle the cup after use at home or in any recycling bin. Look at you doing your part!",FALSE,dissemination,paragraph,FALSE,FALSE,FALSE,FALSE,TRUE,FALSE,TRUE
https://corporate.mcdonalds.com/corpmcd/en-us/our-stories/article/ourstories.better-mplatform.html,McDonalds,recycle,10,"On average, over 60% of our restaurants in eight of McDonald’s largest European markets are already providing recycling for guest packaging. The UK currently stands at 90%, with Germany close behind at 89% of restaurants. By 2025, McDonald’s goal is to recycle guest packaging in 100% of its restaurants globally",TRUE,take action,paragraph,FALSE,FALSE,FALSE,FALSE,TRUE,TRUE,TRUE
https://corporate.mcdonalds.com/corpmcd/en-us/our-stories/article/ourstories.environment_recap_18.html,McDonalds,recycle,2,"By 2025, our goal is to recycle guest packaging in 100 percent of McDonald’s restaurants. We understand that recycling infrastructure, regulations and consumer behaviors vary from city to city and country to country, but we plan to be part of the solution and help influence powerful change.",FALSE,take action,paragraph,FALSE,FALSE,FALSE,FALSE,TRUE,TRUE,FALSE
https://corporate.mcdonalds.com/corpmcd/our-purpose-and-impact/impact-strategy-and-reporting/performance-reports.html,McDonalds,recycle,8,"n 2018, McDonald’s set the global public commitment to recycle guest packaging in 100% of McDonald’s restaurants by the end of 2025. By the end of 2020, over 25% of restaurants in our 30 largest markets offered customers the opportunity to recycle packaging.",TRUE,take action,paragraph,FALSE,FALSE,FALSE,FALSE,TRUE,FALSE,FALSE
https://corporate.mcdonalds.com/corpmcd/en-us/our-stories/article/ourstories.Zero-Waste-Loop.html,McDonalds,recycle,2,This work also builds on progress McDonald's has already made to recycle paper cups in multiple markets. Almost all of McDonald's restaurants across the UK now have recycling units for hot and cold paper cups. ,FALSE,dissemination,paragraph,FALSE,FALSE,FALSE,FALSE,TRUE,FALSE,FALSE
https://corporate.mcdonalds.com/corpmcd/our-purpose-and-impact/our-planet/climate-action.html,McDonalds,recycle,4,"This includes 25 technologies and designs for energy and water efficiency, recycled materials and the ability to recycle the waste generated.",FALSE,dissemination,paragraph,FALSE,TRUE,FALSE,FALSE,TRUE,FALSE,FALSE
https://corporate.mcdonalds.com/corpmcd/en-us/our-stories/article/ourstories.climate_change.html,McDonalds,recycle,2,"Currently, more than 95% of McDonald’s USA restaurants recycle cooking oil for after-market uses. Many McDonald’s franchisees have demonstrated their commitment to supporting our environmental efforts by building green restaurants in their local communities.",FALSE,take action,paragraph,FALSE,FALSE,FALSE,FALSE,TRUE,FALSE,FALSE
https://corporate.mcdonalds.com/corpmcd/our-purpose-and-impact/impact-strategy-and-reporting/contributing-to-UN-SDGs.html,McDonalds,recycle,4,"In our top 35 markets, on average 35% of McDonald's restaurants offer guests the opportunity to recycle packaging items.",TRUE,take action,paragraph,FALSE,FALSE,FALSE,FALSE,TRUE,FALSE,FALSE
https://corporate.mcdonalds.com/corpmcd/en-us/our-stories/article/ourstories.first-vppas-signed.html,McDonalds,recycle,2," Through its Scale for Good platform, the company is also working toward 2025 goals to make 100 percent of McDonald’s guest packaging come from renewable, recycle or certified sources and to recycle guest packaging in 100 percent of McDonald’s restaurants.",FALSE,take action,paragraph,FALSE,FALSE,FALSE,FALSE,TRUE,TRUE,FALSE
https://corporate.mcdonalds.com/corpmcd/en-us/our-stories/article/ourstories.climate-action.html,McDonalds,recycle,2,"McDonald’s packaging and recycling strategy encompasses a wide range of initiatives to reduce our use of packaging, switch to more sustainable materials and help our customers to recycle",FALSE,dissemination,paragraph,FALSE,FALSE,FALSE,FALSE,TRUE,FALSE,FALSE
https://corporate.mcdonalds.com/corpmcd/en-us/our-stories/article/ourstories.world-environ-day-20.html,McDonalds,recycle,1,"Around the world, we’re testing new and innovative ways to learn how we can further reduce packaging, switch to more sustainable materials and help our customers to reuse and recycle.",FALSE,dissemination,paragraph,FALSE,FALSE,FALSE,FALSE,TRUE,FALSE,FALSE
https://corporate.mcdonalds.com/corpmcd/our-purpose-and-impact/our-planet/climate-action.html,McDonalds,emissions,1,McDonald’s Accelerating Climate Action to Reach Net Zero Emissions by 2050,FALSE,dissemination,title,FALSE,FALSE,TRUE,FALSE,FALSE,FALSE,FALSE
https://corporate.mcdonalds.com/corpmcd/en-us/our-stories/article/ourstories.carbon_footprint.html,McDonalds,emissions,8,"To reach this target, we will partner with franchisees and suppliers to reduce greenhouse gas emissions related to McDonald’s restaurants and offices by 36 percent by 2030 from a 2015 base year.",TRUE,take action,paragraph,FALSE,FALSE,TRUE,FALSE,FALSE,TRUE,FALSE
https://corporate.mcdonalds.com/corpmcd/en-us/our-stories/article/ourstories.net-zero-climate.html,McDonalds,emissions,11,"McDonald’s continues to be a leader in the restaurant industry on climate action as we pledge to achieve net zero emissions by 2050 and join the United Nations Race to Zero campaign. We’re also signing on to the Science Based Target initiative Business Ambition for 1.5°C campaign, which means evolving our current climate target to reduce emissions by 2030 to keep global temperature rises under 1.5°C.",FALSE,take action,paragraph,FALSE,FALSE,TRUE,FALSE,FALSE,TRUE,FALSE
https://corporate.mcdonalds.com/corpmcd/our-purpose-and-impact/our-planet.html,McDonalds,emissions,6,"We joined the United Nations Race to Zero campaign, putting McDonald’s on the path to net zero emissions by 2050",FALSE,take action,paragraph,FALSE,FALSE,TRUE,FALSE,FALSE,TRUE,FALSE
https://corporate.mcdonalds.com/corpmcd/en-us/our-stories/article/ourstories.emission_reductions.html,McDonalds,emissions,5,"In McDonald's Switzerland, 59% of our logistics Supplier HAVI's distribution for McDonald's is covered by railway. Last year, this avoided around 490,000 liters of diesel, and meant a reduction of approximately 1.2 million kg of CO2 emissions.",TRUE,take action,paragraph,FALSE,FALSE,TRUE,FALSE,FALSE,FALSE,FALSE
https://corporate.mcdonalds.com/corpmcd/en-us/our-stories/article/ourstories.we_are_still_in_2013546085.html,McDonalds,emissions,5," Additionally, through collaboration and partnership with suppliers and producers, the company is committed to a 31 percent reduction in emissions intensity (per metric ton of food and packaging) in its supply chain by 2030 from 2015 levels.",FALSE,take action,paragraph,FALSE,FALSE,TRUE,TRUE,FALSE,TRUE,FALSE
https://corporate.mcdonalds.com/corpmcd/en-us/our-stories/article/ourstories.sbti_coalition.html,McDonalds,emissions,5,"The restaurant chain aims to build on existing work on forests and agriculture, partnering with its supply chain to invest in programs that help produce its food without increasing greenhouse gas emissions.",FALSE,dissemination,paragraph,FALSE,FALSE,TRUE,FALSE,FALSE,FALSE,TRUE
https://corporate.mcdonalds.com/corpmcd/en-us/our-stories/article/ourstories.renewable-energy.html,McDonalds,emissions,5,These investments in renewable energy are expected to move McDonald’s 16% closer to our Climate Action target to reduce greenhouse gas emissions by 36% from McDonald’s restaurants and offices.,TRUE,take action,paragraph,FALSE,FALSE,TRUE,FALSE,FALSE,TRUE,FALSE
https://corporate.mcdonalds.com/corpmcd/en-us/our-stories/article/ourstories.first-vppas-signed.html,McDonalds,emissions,7," These two U.S. renewable energy projects will represent significant progress toward McDonald’s Climate Action Target to reduce GHG emissions related to McDonald’s restaurants and offices by 36% by 2030.  Once online, the GHG emissions reductions from these two deals are expected to deliver 16% in progress toward our Climate Action Target or 6% in GHG emissions reductions from our 2015 baseline.",TRUE,take action,paragraph,FALSE,FALSE,TRUE,FALSE,FALSE,TRUE,FALSE
https://corporate.mcdonalds.com/corpmcd/en-us/our-stories/article/ourstories.climate_change_532105305.html,McDonalds,emissions,4,"But a new approach to land use that focuses on long-term sustainability and growth instead of immediate, short-term returns can achieve 30 percent[2] of the emissions reductions needed to fulfill the Paris Agreement.",FALSE,dissemination,paragraph,FALSE,FALSE,TRUE,FALSE,FALSE,FALSE,FALSE
https://corporate.mcdonalds.com/corpmcd/en-us/our-stories/article/ourstories.renew-energy-2019.html,McDonalds,emissions,3,Renewable energy is a significant part of our strategy to reduce greenhouse gas emissions across McDonald’s restaurants and offices. ,FALSE,dissemination,paragraph,FALSE,FALSE,TRUE,FALSE,FALSE,FALSE,FALSE
https://corporate.mcdonalds.com/corpmcd/en-us/our-stories/article/ourstories.climate-action.html,McDonalds,emissions,7,"When it comes to beef, we’re in a unique position to use our scale to accelerate the pace and widespread adoption of best practices that reduce emissions and support farmer livelihoods.",FALSE,dissemination,paragraph,FALSE,TRUE,TRUE,FALSE,FALSE,FALSE,FALSE
https://corporate.mcdonalds.com/corpmcd/en-us/our-stories/article/ourstories.gcas_2018.html,McDonalds,emissions,4,"In March, McDonald’s became the first global restaurant company in the world to address climate change by setting a Science Based Target to significantly reduce our greenhouse gas emissions",FALSE,take action,paragraph,FALSE,FALSE,TRUE,FALSE,FALSE,TRUE,FALSE
https://corporate.mcdonalds.com/corpmcd/en-us/our-stories/article/ourstories.environmental_effort.html,McDonalds,emissions,1,"On March 20, the same day McDonald’s announced that it was the first restaurant company in the world to set an approved Science Based Target to reduce greenhouse gas emissions",FALSE,dissemination,paragraph,FALSE,FALSE,TRUE,FALSE,FALSE,FALSE,FALSE
https://corporate.mcdonalds.com/corpmcd/en-us/our-stories/article/ourstories.making_a_big_impact.html,McDonalds,emissions,1,"By upgrading to LED lights in our restaurants we've reduced our carbon dioxide emissions by 100,587 metric tons — that’s equivalent to removing 21,539 cars from the road for an entire year.",TRUE,take action,paragraph,FALSE,FALSE,TRUE,FALSE,FALSE,FALSE,FALSE
https://corporate.mcdonalds.com/corpmcd/en-us/our-stories/article/ourstories.edf_leadership.html,McDonalds,emissions,1,McDonald’s and other leading companies around the globe know what specific actions are needed to reduce emissions,FALSE,take action,statement,FALSE,FALSE,TRUE,FALSE,FALSE,FALSE,FALSE
https://corporate.mcdonalds.com/corpmcd/en-us/our-stories/article/ourstories.coffee_sustainabilit.html,McDonalds,emissions,1,"In March 2018, McDonald’s became the first global restaurant company in the world to address global climate change by setting a target approved by independent experts to significantly reduce its greenhouse gas emissions.",FALSE,take action,paragraph,FALSE,FALSE,TRUE,FALSE,FALSE,TRUE,FALSE
https://corporate.mcdonalds.com/corpmcd/our-purpose-and-impact/food-quality-and-sourcing/responsible-sourcing.html,McDonalds,emissions,8,"By improving these practices, we can enhance soil health and its ability to absorb carbon from the atmosphere, ultimately reducing emissions,",FALSE,dissemination,paragraph,FALSE,TRUE,TRUE,FALSE,FALSE,FALSE,FALSE
https://corporate.mcdonalds.com/corpmcd/en-us/our-stories/article/ourstories.hill_day.html,McDonalds,emissions,1,"McDonald’s experts presented this progress at a briefing on Capitol Hill in Washington, DC, where Members of Congress and staff learned about the company’s sustainability efforts, from charting Science Based Targets to advancing sustainable beef production practices, reducing greenhouse gas emissions and designing more sustainable packaging.",FALSE,dissemination,paragraph,FALSE,FALSE,TRUE,FALSE,FALSE,TRUE,FALSE
https://corporate.mcdonalds.com/corpmcd/en-us/our-stories/article/ourstories.world-environ-day-20.html,McDonalds,emissions,5,"We’ve been on this journey for a number of years and I’m proud that McDonald’s was the first global restaurant company to set a Science Based Target to reduce greenhouse gas emissions related to our restaurants and offices, and across our supply chain by 2030.",FALSE,take action,paragraph,FALSE,FALSE,TRUE,FALSE,FALSE,TRUE,FALSE
https://corporate.mcdonalds.com/corpmcd/en-us/our-stories/article/ourstories.rainforest_alliance.html,McDonalds,emissions,1,"In March, McDonald’s became the first restaurant company to set an approved Science Based Target to reduce greenhouse gas emissions.",FALSE,take action,paragraph,FALSE,FALSE,FALSE,FALSE,FALSE,TRUE,FALSE
https://corporate.mcdonalds.com/corpmcd/en-us/our-stories/article/ourstories.environment_recap_18.html,McDonalds,emissions,4,"By the same deadline, we also seek a 31 percent reduction in emissions intensity (per metric ton of food and packaging) across our supply chain, measuring from 2015. ",TRUE,take action,paragraph,FALSE,FALSE,TRUE,FALSE,FALSE,TRUE,FALSE
https://corporate.mcdonalds.com/corpmcd/our-purpose-and-impact/our-planet/nature-forests-water.html,McDonalds,natural,11,"We’re taking a holistic approach to protecting natural resources, the communities that rely on them and the future of our business.",FALSE,take action,statement,FALSE,TRUE,TRUE,FALSE,FALSE,TRUE,FALSE
https://corporate.mcdonalds.com/corpmcd/our-purpose-and-impact/our-planet.html,McDonalds,natural,4,"We aim to help preserve and regenerate nature, support biodiversity and engage the communities and farmers closest to natural ecosystems to build resilience together. By using natural resources in ways that help protect the environment – and encouraging others to do the same – we can continue reducing our impact while helping contribute to nature-positive supply chains and a more sustainable global economy.",FALSE,take action,paragraph,FALSE,FALSE,FALSE,FALSE,FALSE,TRUE,FALSE
